[
  {
    "id": "gin",
    "language": "go",
    "url": "https://github.com/gin-gonic/gin",
    "pin": "v1.10.0",
    "cohort": 1,
    "license": "MIT"
  },
  {
    "id": "caddy",
    "language": "go",
    "url": "https://github.com/caddyserver/caddy",
    "pin": "v2.8.4",
    "cohort": 1,
    "license": "Apache-2.0"
  },
  {
    "id": "prometheus",
    "language": "go",
    "url": "https://github.com/prometheus/prometheus",
    "pin": "v2.54.1",
    "cohort": 1,
    "license": "Apache-2.0"
  },
  {
    "id": "arch-samples",
    "language": "kotlin",
    "url": "https://github.com/android/architecture-samples",
    "pin": null,
    "cohort": 1,
    "license": "Apache-2.0"
  },
  {
    "id": "detekt",
    "language": "kotlin",
    "url": "https://github.com/detekt/detekt",
    "pin": null,
    "cohort": 1,
    "license": "Apache-2.0"
  },
  {
    "id": "coroutines",
    "language": "kotlin",
    "url": "https://github.com/Kotlin/kotlinx.coroutines",
    "pin": null,
    "cohort": 1,
    "license": "UNKNOWN"
  },
  {
    "id": "syncthing",
    "language": "go",
    "url": "https://github.com/syncthing/syncthing",
    "pin": null,
    "cohort": 2,
    "license": "MPL-2.0"
  },
  {
    "id": "okhttp",
    "language": "kotlin",
    "url": "https://github.com/square/okhttp",
    "pin": null,
    "cohort": 2,
    "license": "Apache-2.0"
  },
  {
    "id": "ktor",
    "language": "kotlin",
    "url": "https://github.com/ktorio/ktor",
    "pin": null,
    "cohort": 2,
    "license": "Apache-2.0"
  },
  {
    "id": "kubernetes",
    "language": "go",
    "url": "https://github.com/kubernetes/kubernetes",
    "pin": null,
    "cohort": 3,
    "license": "Apache-2.0"
  },
  {
    "id": "kotlin",
    "language": "kotlin",
    "url": "https://github.com/JetBrains/kotlin",
    "pin": null,
    "cohort": 3,
    "license": "NONE"
  },
  {
    "id": "serde",
    "language": "rust",
    "url": "https://github.com/serde-rs/serde",
    "pin": "HEAD",
    "cohort": 2,
    "license": "Apache-2.0"
  },
  {
    "id": "serilog",
    "language": "csharp",
    "url": "https://github.com/serilog/serilog",
    "pin": "HEAD",
    "cohort": 2,
    "license": "Apache-2.0"
  },
  {
    "id": "nest",
    "language": "typescript",
    "url": "https://github.com/nestjs/nest",
    "pin": "v11.1.28",
    "cohort": 4,
    "license": "MIT"
  },
  {
    "id": "vue-core",
    "language": "typescript",
    "url": "https://github.com/vuejs/core",
    "pin": "v3.5.40",
    "cohort": 4,
    "license": "MIT"
  },
  {
    "id": "angular",
    "language": "typescript",
    "url": "https://github.com/angular/angular",
    "pin": "v22.0.8",
    "cohort": 4,
    "license": "MIT"
  },
  {
    "id": "django",
    "language": "python",
    "url": "https://github.com/django/django",
    "pin": "5.2.8",
    "cohort": 4,
    "license": "BSD-3-Clause"
  },
  {
    "id": "fastapi",
    "language": "python",
    "url": "https://github.com/fastapi/fastapi",
    "pin": "0.140.10",
    "cohort": 4,
    "license": "MIT"
  },
  {
    "id": "flask",
    "language": "python",
    "url": "https://github.com/pallets/flask",
    "pin": "3.1.3",
    "cohort": 4,
    "license": "BSD-3-Clause"
  },
  {
    "id": "spring-boot",
    "language": "java",
    "url": "https://github.com/spring-projects/spring-boot",
    "pin": "v4.1.0",
    "cohort": 4,
    "license": "Apache-2.0"
  },
  {
    "id": "guava",
    "language": "java",
    "url": "https://github.com/google/guava",
    "pin": "v33.6.0",
    "cohort": 4,
    "license": "Apache-2.0"
  },
  {
    "id": "rxjava",
    "language": "java",
    "url": "https://github.com/ReactiveX/RxJava",
    "pin": "v3.1.11",
    "cohort": 4,
    "license": "Apache-2.0"
  },
  {
    "id": "powershell",
    "language": "csharp",
    "url": "https://github.com/PowerShell/PowerShell",
    "pin": "v7.6.4",
    "cohort": 4,
    "license": "MIT"
  },
  {
    "id": "avalonia",
    "language": "csharp",
    "url": "https://github.com/AvaloniaUI/Avalonia",
    "pin": "12.1.0",
    "cohort": 4,
    "license": "MIT"
  },
  {
    "id": "newtonsoft-json",
    "language": "csharp",
    "url": "https://github.com/JamesNK/Newtonsoft.Json",
    "pin": "13.0.4",
    "cohort": 4,
    "license": "UNKNOWN"
  },
  {
    "id": "nvm",
    "language": "bash",
    "url": "https://github.com/nvm-sh/nvm",
    "pin": "v0.40.6",
    "cohort": 4,
    "license": "MIT"
  },
  {
    "id": "neofetch",
    "language": "bash",
    "url": "https://github.com/dylanaraps/neofetch",
    "pin": "7.1.0",
    "cohort": 4,
    "license": "MIT"
  },
  {
    "id": "tf-aws-vpc",
    "language": "hcl",
    "url": "https://github.com/terraform-aws-modules/terraform-aws-vpc",
    "pin": "v6.6.1",
    "cohort": 4,
    "license": "Apache-2.0"
  },
  {
    "id": "tf-aws-eks",
    "language": "hcl",
    "url": "https://github.com/terraform-aws-modules/terraform-aws-eks",
    "pin": "v21.24.0",
    "cohort": 4,
    "license": "Apache-2.0"
  },
  {
    "id": "swift-argument-parser",
    "language": "swift",
    "url": "https://github.com/apple/swift-argument-parser",
    "pin": "2f77f2fccb6e84fecff338c37b199e33e7dfd119",
    "cohort": 5,
    "license": "Apache-2.0"
  },
  {
    "id": "swift-tagged",
    "language": "swift",
    "url": "https://github.com/pointfreeco/swift-tagged",
    "pin": "6a8517578035408b6c14ccba00ee990a1435515c",
    "cohort": 5,
    "license": "MIT"
  },
  {
    "id": "swift-collections",
    "language": "swift",
    "url": "https://github.com/apple/swift-collections",
    "pin": "ff27e3678ddb895ebf917ce513f3105395078dae",
    "cohort": 5,
    "license": "Apache-2.0"
  },
  {
    "id": "alamofire",
    "language": "swift",
    "url": "https://github.com/Alamofire/Alamofire",
    "pin": "0455bfb650893e86ad07ace16e5f2d36dadf46f4",
    "cohort": 5,
    "license": "MIT"
  },
  {
    "id": "swift",
    "language": "swift",
    "url": "https://github.com/swiftlang/swift",
    "pin": "1f52e6384c7b59aba5e13a617900117559dad8e2",
    "cohort": 5,
    "license": "Apache-2.0"
  },
  {
    "id": "telegram-ios",
    "language": "swift",
    "url": "https://github.com/TelegramMessenger/Telegram-iOS",
    "pin": "6ad963e5b62d354da79040f388ae2b9132fb17b8",
    "cohort": 5,
    "license": "NONE"
  },
  {
    "id": "swift-nio",
    "language": "swift",
    "url": "https://github.com/apple/swift-nio",
    "pin": "8c063f043d94c120d0f8d6303ef4fc7918e3561d",
    "cohort": 12,
    "license": "Apache-2.0"
  },
  {
    "id": "swift-composable-architecture",
    "language": "swift",
    "url": "https://github.com/pointfreeco/swift-composable-architecture",
    "pin": "377da4061db10d26337a71bb279c506bb951f50f",
    "cohort": 12,
    "license": "MIT"
  },
  {
    "id": "dart-web",
    "language": "dart",
    "url": "https://github.com/dart-lang/web",
    "pin": "f1b9d561850355efd81b24fdbfd226dbe805d415",
    "cohort": 5,
    "license": "BSD-3-Clause"
  },
  {
    "id": "vaden",
    "language": "dart",
    "url": "https://github.com/Flutterando/vaden",
    "pin": "647379af4b3f1bb33466474538e3ee16547dd85b",
    "cohort": 5,
    "license": "MIT"
  },
  {
    "id": "drift",
    "language": "dart",
    "url": "https://github.com/simolus3/drift",
    "pin": "f9f4eba656c1724999c4fc015ac051162dd17a23",
    "cohort": 5,
    "license": "MIT"
  },
  {
    "id": "localsend",
    "language": "dart",
    "url": "https://github.com/localsend/localsend",
    "pin": "c021834b39c41cf7c6b4d9450453e5dc42696314",
    "cohort": 5,
    "license": "Apache-2.0"
  },
  {
    "id": "dart-sdk",
    "language": "dart",
    "url": "https://github.com/dart-lang/sdk",
    "pin": "f300393bdf6136f4be35d877763ab73c7c715647",
    "cohort": 5,
    "license": "BSD-3-Clause"
  },
  {
    "id": "flutter",
    "language": "dart",
    "url": "https://github.com/flutter/flutter",
    "pin": "de01d5daa62dcb2fd0378d55206c91e4cf008923",
    "cohort": 5,
    "license": "BSD-3-Clause"
  },
  {
    "id": "dry-monads",
    "language": "ruby",
    "url": "https://github.com/dry-rb/dry-monads",
    "pin": "9039d58b1c0fb82a27410e1bb5b9a5e20303f86f",
    "cohort": 5,
    "license": "MIT"
  },
  {
    "id": "secure_headers",
    "language": "ruby",
    "url": "https://github.com/github/secure_headers",
    "pin": "e62871dcf6aa91bce53b7fbd6ea8667e6c3f25cc",
    "cohort": 5,
    "license": "MIT"
  },
  {
    "id": "jekyll",
    "language": "ruby",
    "url": "https://github.com/jekyll/jekyll",
    "pin": "7697d249793d6c48c66a7293310a718aec01f660",
    "cohort": 5,
    "license": "MIT"
  },
  {
    "id": "brew",
    "language": "ruby",
    "url": "https://github.com/Homebrew/brew",
    "pin": "2a2dac58e6213e6b54e4bf989c0995e999f3db90",
    "cohort": 5,
    "license": "BSD-2-Clause"
  },
  {
    "id": "rails",
    "language": "ruby",
    "url": "https://github.com/rails/rails",
    "pin": "aea7861375d584b4e3f6036940d009986d8cc757",
    "cohort": 5,
    "license": "MIT"
  },
  {
    "id": "gitlabhq",
    "language": "ruby",
    "url": "https://github.com/gitlabhq/gitlabhq",
    "pin": "1d31c6f29bfc064c6926809923721e69f5690aa5",
    "cohort": 5,
    "license": "NOASSERTION"
  },
  {
    "id": "nimble_csv",
    "language": "elixir",
    "url": "https://github.com/dashbitco/nimble_csv",
    "pin": "8cc4e68151975e5ff6eb1ad4a738a728bcb17a1e",
    "cohort": 5,
    "license": "NONE"
  },
  {
    "id": "plug_crypto",
    "language": "elixir",
    "url": "https://github.com/elixir-plug/plug_crypto",
    "pin": "cdbd36c0add6ede5c5e277980c104fc90aefc0be",
    "cohort": 5,
    "license": "NOASSERTION"
  },
  {
    "id": "ecto",
    "language": "elixir",
    "url": "https://github.com/elixir-ecto/ecto",
    "pin": "e7144cd5c72fe13f77bf31fa54c41cc354643491",
    "cohort": 5,
    "license": "Apache-2.0"
  },
  {
    "id": "phoenix",
    "language": "elixir",
    "url": "https://github.com/phoenixframework/phoenix",
    "pin": "1abb125bf22610a4c38b773b537186902bc5b576",
    "cohort": 5,
    "license": "MIT"
  },
  {
    "id": "elixir",
    "language": "elixir",